RISK_ID,SEARCH_TERM_ID,GOOGLE_INDEX,TITLE,LINK,PUBLISHED_DATE,SUMMARY,KEYWORDS,SENTIMENT_COMPOUND,SENTIMENT,SOURCE,SOURCE_URL,PAYWALLED,CREDIBILITY_TYPE,QUALITY_SCORE,SCORE_RELEVANCE,SCORE_RECENCY,SCORE_LENGTH_150,SCORE_LENGTH_500,SCORE_WHITELIST_BONUS,SCORE_CLICKBAIT_PENALTY
2,2,46,Cyberattack ensnares Ann Arbor-based site for municipal bonds - Crain's Detroit Business,https://www.crainsdetroit.com/banking-finance/cyberattack-ensnares-ann-arbor-based-munios-municipal-bond-site,2025-10-16 05:52:06,"A ransomware attack is disrupting state and local borrowers’ ability to post debt documents on the $4.3 trillion municipal-bond market’s main distribution platform.

MuniOS, a website operated by Ann Arbor-based tech company ImageMaster LLC, has been out of service for several days due to the cyberattack, according to people familiar with the matter who asked not to be named discussing the private matter.

Borrowers use the website to showcase their bond offering documents, and it’s a popular se",,-0.0772,Negative,Crainsdetroit,https://www.crainsdetroit.com/banking-finance/cyberattack-ensnares-ann-arbor-based-munios-municipal-bond-site,False,Relevant Article,1,0,1,0,0,0,0
2,2,73,Nintendo Denies Data Leak After Alleged Cyberattack Claim by Hacker Group - Twisted Voxel,https://twistedvoxel.com/nintendo-denies-data-leak-after-alleged-cyberattack-claim-by-hacker-group/,2025-10-16 04:51:52,"Nintendo has officially denied reports of a data breach following online claims from a hacker group alleging that they had successfully infiltrated the company’s systems. In a statement provided to the Sankei Shimbun on October 15, the gaming giant assured the public that there was “no confirmation of any leakage of personal information, nor any breach of development or business information.” The company also clarified that while some external servers used for hosting parts of its website were t",,-0.34,Negative,Twistedvoxel,https://twistedvoxel.com/nintendo-denies-data-leak-after-alleged-cyberattack-claim-by-hacker-group/,False,Relevant Article,1,0,1,0,0,0,0
2,2,72,Airport officials say cyberattack at HIA 'wasn't a threat' - WGAL,https://www.wgal.com/article/airport-officials-say-cyberattack-hia-wasnt-threat/69049015,2025-10-16 01:04:00,"Harrisburg International Airport experienced an unexpected broadcast of an unauthorized political message over its loudspeakers for about 10 minutes on Tuesday night, though airport officials say there was no threat issued.

Harrisburg International Airport experienced an unexpected broadcast of a pro-Palestinian political message over its loudspeakers for about 10 minutes on Tuesday night, which included profanity and references to President Donald Trump and Israeli Prime Minister Benjamin Neta",,0.6759,Positive,Wgal,https://www.wgal.com/article/airport-officials-say-cyberattack-hia-wasnt-threat/69049015,False,Relevant Article,1,0,1,0,0,0,0
2,2,47,"Microsoft: Russia, China increasingly using AI to escalate cyberattacks on the US - The Virginian-Pilot",https://www.pilotonline.com/2025/10/16/microsoft-ai-cyberattacks/,2025-10-16 00:00:00,"By DAVID KLEPPER, Associated Press

WASHINGTON (AP) — Russia, China, Iran and North Korea have sharply increased their use of artificial intelligence to deceive people online and mount cyberattacks against the United States, according to new research from Microsoft.

This July, the company identified more than 200 instances of foreign adversaries using AI to create fake content online, more than double the number from July 2024 and more than ten times the number seen in 2023.

The findings, publ",,0.4404,Positive,Pilotonline,https://www.pilotonline.com/2025/10/16/microsoft-ai-cyberattacks/,False,Relevant Article,2,1,1,0,0,0,0
2,2,18,Extortion and ransomware drive over half of cyberattacks - Microsoft Source,https://news.microsoft.com/europe/2025/10/16/extortion-and-ransomware-drive-over-half-of-cyberattacks/,2025-10-16 00:00:00,"Extortion and ransomware drive over half of cyberattacks

Extortion and ransomware drive over half of cyberattacks

In the first half of 2025, Microsoft data showed Ireland ranked 46th globally among countries where customers were most frequently impacted by cyber activity, and 20 th in Europe.

in Europe. The data also showed that Ireland accounted for approximately 1.2% of customers impacted by cyber activity in Europe.

Despite increasing threat sophistication, 30% of Irish workers say they r",,0.4168,Positive,News,https://news.microsoft.com/europe/2025/10/16/extortion-and-ransomware-drive-over-half-of-cyberattacks/,False,Relevant Article,2,1,1,0,0,0,0
2,2,35,"Russian cyber-attacks against Nato states up by 25% in a year, analysis finds - The Guardian",https://www.theguardian.com/world/2025/oct/16/russian-cyber-attacks-against-nato-states-up-by-25-in-a-year-analysis-finds,2025-10-16 00:00:00,"Russia has increased cyber-attacks against Nato states by 25% over the past year, according to an analysis, as the Kremlin escalates its “hybrid war” against European countries.

Microsoft said nine of the top 10 countries most affected by Russian state cyber-activity were members of the Nato alliance and attacks against them had risen by a quarter compared with the previous year.

The US was the most targeted region, at 20% of all attacks, followed by the UK at 12% and Ukraine – the only non-Na",,-0.5849,Negative,Theguardian,https://www.theguardian.com/world/2025/oct/16/russian-cyber-attacks-against-nato-states-up-by-25-in-a-year-analysis-finds,False,Relevant Article,1,0,1,0,0,0,0
2,2,44,Auction house Sotheby's finds its data on the block after cyberattack - theregister.com,https://www.theregister.com/2025/10/16/sothebys_breach/,2025-10-16 00:00:00,"Auction house Sotheby's says it was breached on July 24, and those behind the intrusion stole an unspecified amount of data, including Social Security numbers and financial account information.

The multinational broker of fine art and luxury items said it is not aware of who was behind the attack, but confirmed in a filing with the state's Attorney General's Office this week that two Maine residents were affected by the breach.

The Register asked the auctioneer for more information about the t",,-0.4215,Negative,Theregister,https://www.theregister.com/2025/10/16/sothebys_breach/,False,Relevant Article,1,0,1,0,0,0,0
2,2,1,Extortion and ransomware drive over half of cyberattacks - The Official Microsoft Blog,https://blogs.microsoft.com/on-the-issues/2025/10/16/mddr-2025/,2025-10-16 00:00:00,"In 80% of the cyber incidents Microsoft’s security teams investigated last year, attackers sought to steal data—a trend driven more by financial gain than intelligence gathering. According to the latest Microsoft Digital Defense Report, written with our Chief Information Security Officer Igor Tsyganskiy, over half of cyberattacks with known motives were driven by extortion or ransomware. That’s at least 52% of incidents fueled by financial gain, while attacks focused solely on espionage made up ",,0.8055,Positive,Blogs,https://blogs.microsoft.com/on-the-issues/2025/10/16/mddr-2025/,False,Relevant Article,2,1,1,0,0,0,0
2,2,57,"Microsoft: Russia, China increasingly using AI to escalate cyberattacks on the US - CNBC",https://www.cnbc.com/amp/2025/10/16/microsoft-russia-china-increasingly-using-ai-to-escalate-cyberattacks-on-the-us.html,2025-10-16 00:00:00,"The findings, published Thursday in Microsoft's annual digital threats report, show how foreign adversaries are adopting new and innovative tactics in their efforts to weaponize the internet as a tool for espionage and deception.

AI's potential said to be exploited by U.S. foes

America's adversaries, as well as criminal gangs and hacking companies, have exploited AI's potential, using it to automate and improve cyberattacks, to spread inflammatory disinformation and to penetrate sensitive syst",,-0.9217,Negative,Cnbc,https://www.cnbc.com/amp/2025/10/16/microsoft-russia-china-increasingly-using-ai-to-escalate-cyberattacks-on-the-us.html,False,Relevant Article,2,1,1,0,0,0,0
2,2,21,How to Safeguard Your Online Presence from Social Engineering Cyberattacks - Cybersecurity Insiders,https://www.cybersecurity-insiders.com/how-to-safeguard-your-online-presence-from-social-engineering-cyberattacks/,2025-10-15 15:45:47,"Social engineering attacks don’t rely on breaking into systems through sophisticated software or hardware vulnerabilities; instead, they exploit human psychology, trust, and emotions. Hackers use social engineering to trick people into giving up passwords, credit card details, or other sensitive data. These attacks can occur in the form of phishing, spear-phishing, pretexting, baiting, or even impersonation.

Let’s dive into practical ways to safeguard your online presence from these dangerous a",,0.7184,Positive,Cybersecurity-insiders,https://www.cybersecurity-insiders.com/how-to-safeguard-your-online-presence-from-social-engineering-cyberattacks/,False,Relevant Article,2,1,1,0,0,0,0
2,2,52,Taiwan warns Chinese cyberattacks are intensifying - TechRadar,https://www.techradar.com/pro/security/taiwan-warns-chinese-cyberattacks-are-intensifying,2025-10-15 13:24:00,"Taiwan faces 2.8 million daily cyber intrusions, mostly attributed to Chinese threat actors

China allegedly spreads pro-Beijing misinformation via 10,000 troll accounts and 1.5 million fake posts

Groups like APT41 and Volt Typhoon target critical sectors; China denies all cyberattack allegations

China’s cyberattacks and misinformation campaigns against Taiwan are escalating, as the Red Dragon looks to degrade public trust against the government ahead of the Taiwanese 2026 local elections.

Th",,-0.9136,Negative,Techradar,https://www.techradar.com/pro/security/taiwan-warns-chinese-cyberattacks-are-intensifying,False,Relevant Article,2,1,1,0,0,0,0
2,2,70,"Russian internet provider 'impoverished by 66 million rubles' after Ukrainian cyberattack, HUR source claims - The Kyiv Independent",https://kyivindependent.com/russian-internet-provider-impoverished-by-66-million-rubles-after-ukrainian-cyberattack-hur-source-claims/,2025-10-15 11:59:41,"A cyberattack carried out by Ukraine’s military intelligence (HUR) caused over 66 million rubles (approximately $800,000) in damages to Orion Telecom, one of the largest internet providers in Siberia, a HUR source told the Kyiv Independent.

According to the source, the provider itself reported the losses in a complaint submitted to Russian police following the attack. The company also admitted that the cyber operation led to a leak of users’ personal data.

""One of the largest Siberian Internet",,-0.8316,Negative,Kyivindependent,https://kyivindependent.com/russian-internet-provider-impoverished-by-66-million-rubles-after-ukrainian-cyberattack-hur-source-claims/,False,Relevant Article,1,0,1,0,0,0,0
2,2,68,Dealer software firms boost cyber defenses after CDK hack shakes industry - Automotive News,https://www.autonews.com/retail/anc-spotlight-cybersecurity/,2025-10-15 11:58:08,"The Proton Dealership IT and Security command centre in Dayton, Ohio, continually monitors client systems for hacking attempts.

(PROTON)",,0.7003,Positive,Autonews,https://www.autonews.com/retail/anc-spotlight-cybersecurity/,False,Relevant Article,1,0,1,0,0,0,0
2,2,82,"Shelbyville Police dealing with cyberattack, disrupted computer systems - WAVE News",https://www.wave3.com/2025/10/15/shelbyville-police-dealing-with-cyberattack-disrupting-computer-systems/,2025-10-15 00:00:00,"LOUISVILLE, Ky. (WAVE) - Officials in Shelbyville are investigating a cyberattack on the police department.

Police chief Bruce Gentry said the incident is affecting their network, and disrupting some of their computer systems.

Chief Gentry tells WAVE they have launched an investigation for the cause of the incident, and they ask for patience as they work to restore their systems.

Anyone filing an accident or incident report can still access them.

Copyright 2025 WAVE. All rights reserved.",,-0.1027,Negative,Wave3,https://www.wave3.com/2025/10/15/shelbyville-police-dealing-with-cyberattack-disrupting-computer-systems/,False,Relevant Article,1,0,1,0,0,0,0
2,2,17,The importance of hardening customer support tools against cyberattacks - Microsoft,https://www.microsoft.com/en-us/security/blog/2025/10/15/the-importance-of-hardening-customer-support-tools-against-attack/,2025-10-15 00:00:00,"The Deputy CISO blog series is where Microsoft Deputy Chief Information Security Officers (CISOs) share their thoughts on what is most important in their respective domains. In this series, you will get practical advice, tactics to start (and stop) deploying, forward-looking commentary on where the industry is going, and more. In this article, Raji Dani, Vice President and Deputy CISO for Microsoft business functions, finance, and marketing at Microsoft dives into the importance of securing cust",,0.9359,Positive,Microsoft,https://www.microsoft.com/en-us/security/blog/2025/10/15/the-importance-of-hardening-customer-support-tools-against-attack/,False,Relevant Article,2,1,1,0,0,0,0
2,2,91,Recovering and rebuilding trust after a cyberattack [Q&A] - BetaNews,https://betanews.com/2025/10/15/recovering-and-rebuilding-trust-after-a-cyberattack-qa/,2025-10-15 00:00:00,"However good your defenses, cyberattacks can still happen. However, in many cases, the aftermath can be worse than the attack itself, as enterprises struggle to calm nerves and reassure staff, customers, and shareholders.

We spoke with Daniel Tobok, CEO of incident response specialist CYPFER, to discuss how organizations can recover from a cyberattack and why the leadership's response is vital.

BN: What are the first steps an organization should take to develop a robust post-breach plan, espec",,0.743,Positive,Betanews,https://betanews.com/2025/10/15/recovering-and-rebuilding-trust-after-a-cyberattack-qa/,False,Relevant Article,2,1,1,0,0,0,0
2,2,77,New Cyberattack Leverages NPM Ecosystem to Infect Developers While Installing Packages - Cyber Security News,https://cybersecuritynews.com/new-cyberattack-leverages-npm-ecosystem/,2025-10-14 19:10:09,"Cybersecurity researchers have uncovered a sophisticated phishing campaign that weaponizes the NPM ecosystem through an unprecedented attack vector.

Unlike traditional malicious package installations, this operation leverages the trusted unpkg.com CDN to deliver phishing scripts directly through browsers, targeting enterprise employees across 135+ organizations primarily in Europe’s industrial, technology, and energy sectors.

The campaign, discovered in October 2025, represents a dangerous evo",,0.6124,Positive,Cybersecuritynews,https://cybersecuritynews.com/new-cyberattack-leverages-npm-ecosystem/,False,Relevant Article,1,0,1,0,0,0,0
2,2,22,Support for Windows 10 Ends Today Leaving Users Vulnerable to Cyberattacks - Cyber Security News,https://cybersecuritynews.com/windows-10-support-ends/,2025-10-14 16:59:33,"Microsoft officially ended support for Windows 10, marking the close of a decade-long era for one of the most popular operating systems in history.

This means that as of today, the company will no longer deliver free security updates, feature enhancements, or technical assistance for the OS, leaving millions of devices potentially exposed to emerging threats.

With Windows 10 powering around 43% of global Windows devices as recently as July 2025, the transition poses significant challenges for ",,0.8883,Positive,Cybersecuritynews,https://cybersecuritynews.com/windows-10-support-ends/,False,Relevant Article,2,1,1,0,0,0,0
2,2,56,"Harvard University hit in Oracle EBS cyberattack, 1.3 TB of data leaked by Cl0p group - Security Affairs",https://securityaffairs.com/183379/security/harvard-university-hit-in-oracle-ebs-cyberattack-1-3-tb-of-data-leaked-by-cl0p-group.html,2025-10-14 14:08:07,"Harvard University hit in Oracle EBS cyberattack, 1.3 TB of data leaked by Cl0p group

Pierluigi Paganini October 14, 2025 October 14, 2025

Harvard University confirmed being targeted in the Oracle EBS campaign after the Cl0p ransomware group leaked 1.3 TB of data.

Harvard University confirmed it was targeted in the Oracle E-Business Suite campaign after the Cl0p ransomware group listed it on its leak site. The cybercrime group claimed to have leaked 1.3 TB of data allegedly stolen from Harvar",,-0.886,Negative,Securityaffairs,https://securityaffairs.com/183379/security/harvard-university-hit-in-oracle-ebs-cyberattack-1-3-tb-of-data-leaked-by-cl0p-group.html,False,Relevant Article,1,0,1,0,0,0,0
2,2,97,Britain sees 50% spike in major cyber attacks as top firms targeted - The Straits Times,https://www.straitstimes.com/world/europe/uk-sees-50-spike-in-major-cyberattacks-as-top-firms-targeted,2025-10-14 13:20:00,"Sign up now: Get ST's newsletters delivered to your inbox

Britain’s National Cyber Security Centre said it had dealt with 429 cyber incidents in the 12 months to the end of August.

– Britain saw a significant increase in major cyber attacks by criminals and hostile states over 2024, the country’s cyber-security agency said, following a spate of high-profile incidents targeting companies from Jaguar Land Rover to the Marks and Spencer Group.

Britain’s National Cyber Security Centre (NCSC), par",,-0.6068,Negative,Straitstimes,https://www.straitstimes.com/world/europe/uk-sees-50-spike-in-major-cyberattacks-as-top-firms-targeted,False,Relevant Article,1,0,1,0,0,0,0
2,2,54,"UK Cyberattacks Surge to Record 429 in 2024-2025, NCSC Reports - WebProNews",https://www.webpronews.com/uk-cyberattacks-surge-to-record-429-in-2024-2025-ncsc-reports/,2025-10-14 11:53:27,"In the escalating realm of global cybersecurity threats, the United Kingdom finds itself under siege, with cyberattacks reaching unprecedented levels. According to a recent report from the National Cyber Security Centre (NCSC), the nation is grappling with an average of four “nationally significant” incidents every week. This alarming statistic emerges from the NCSC’s 2024 annual review, which details assistance provided in 429 attacks from September 2024 to late August 2025. Among these, 204 we",,-0.0836,Negative,Webpronews,https://www.webpronews.com/uk-cyberattacks-surge-to-record-429-in-2024-2025-ncsc-reports/,False,Relevant Article,2,1,1,0,0,0,0
2,2,41,NCSC demands action amid 50% surge in major UK cyberattacks - theregister.com,https://www.theregister.com/2025/10/14/ncsc_uk_cyberattack_surge/,2025-10-14 00:00:00,"Cyberattacks that meet upper severity thresholds set by the UK government's cyber agents have risen 50 percent in the last year, despite almost zero change in the volume of cases handled.

GCHQ's cyber arm, the National Cyber Security Centre's (NCSC), said in its annual review published today that its incident management team handled 429 cyberattacks on organizations in the past 12 months, one fewer than the same reporting period in last year's review.

However, the number of nationally signific",,0.4019,Positive,Theregister,https://www.theregister.com/2025/10/14/ncsc_uk_cyberattack_surge/,False,Relevant Article,2,1,1,0,0,0,0
2,2,2,Top 7 Cyber Attacks in the United States - SentinelOne,https://www.sentinelone.com/cybersecurity-101/cybersecurity/cyber-attacks-in-the-united-states/,2025-10-13 00:00:00,"Cybersecurity What is a Firewall? Firewalls are critical in network security. Explore how they function and their role in protecting sensitive data from unauthorized access. Read More

Cybersecurity What is Red Hat OpenShift? Red Hat OpenShift offers a platform for containerized applications. Learn how to secure your OpenShift deployments effectively. Read More

Cybersecurity What is Hacktivism? Hacktivism blurs the lines between activism and cybercrime. Explore the motivations behind hacktivism",,0.7677,Positive,Sentinelone,https://www.sentinelone.com/cybersecurity-101/cybersecurity/cyber-attacks-in-the-united-states/,False,Relevant Article,1,0,1,0,0,0,0
