RISK_ID,SEARCH_TERM_ID,GOOGLE_INDEX,TITLE,LINK,PUBLISHED_DATE,SUMMARY,KEYWORDS,SENTIMENT_COMPOUND,SENTIMENT,SOURCE,SOURCE_URL,PAYWALLED,CREDIBILITY_TYPE,QUALITY_SCORE,SCORE_RELEVANCE,SCORE_RECENCY,SCORE_LENGTH_150,SCORE_LENGTH_500,SCORE_WHITELIST_BONUS,SCORE_CLICKBAIT_PENALTY
2,2,83,Ukraine Ranks 5th Globally in Cyberattack Targets in 2025 - Букви,https://mezha.net/eng/bukvy/ukraine-ranks-5th-globally-in-cyberattack-targets-in-2025/amp/,2025-10-17 17:33:46,"According to the report Digital Defense Report 2025 by Microsoft

In the first half of 2025, Ukraine ranked fifth worldwide in the share of cyberattacks against the country, while leading Europe in the number of operations conducted by other states. These data come from the Digital Defense Report 2025, published by Microsoft.

In the global threat distribution, the top positions are held by the United States (24.8%), the United Kingdom (5.6%), Israel (3.5%), Germany (3.3%), and Ukraine accounts ",,0.7579,Positive,Mezha,https://mezha.net/eng/bukvy/ukraine-ranks-5th-globally-in-cyberattack-targets-in-2025/amp/,False,Relevant Article,2,1,1,0,0,0,0
2,2,31,"Tech Report: Smart glasses, AI cyberattacks, digital remittances, Bezos’ space prediction - 41NBC News",https://www.41nbc.com/tech-report-smart-glasses-ai-cyberattacks-digital-remittances-bezos-space-prediction/,2025-10-17 16:20:20,"Tech Report: Smart glasses, AI cyberattacks, digital remittances, Bezos’ space prediction

EssilorLuxottica is doubling down on the future of smart glasses, investing in eyewear that lets users play music and take photos — all hands-free.

(LILAMAX)- EssilorLuxottica is doubling down on the future of smart glasses, investing in eyewear that lets users play music and take photos — all hands-free. The company’s CEO says he believes glasses will eventually replace much of what smartphones do today.",,0.9274,Positive,41nbc,https://www.41nbc.com/tech-report-smart-glasses-ai-cyberattacks-digital-remittances-bezos-space-prediction/,False,Relevant Article,2,1,1,0,0,0,0
2,2,78,Microsoft study says most cyber attacks are for Money and not for Espionage - Cybersecurity Insiders,https://www.cybersecurity-insiders.com/microsoft-study-says-most-cyber-attacks-are-for-money-and-not-for-espionage/,2025-10-17 15:23:42,"Microsoft, in its latest annual Digital Defense Report has shed light on the current trends in cybercrime, revealing that the majority of cyber attacks are financially motivated rather than politically driven. The tech giant’s study, which covered the period from July 2024 to June 2025, found that cybercriminals are increasingly targeting organizations for monetary gain, with state-sponsored hacking actors playing a significant role as well.

The United States stood out as the primary target for",,0.8085,Positive,Cybersecurity-insiders,https://www.cybersecurity-insiders.com/microsoft-study-says-most-cyber-attacks-are-for-money-and-not-for-espionage/,False,Relevant Article,1,0,1,0,0,0,0
2,2,10,How Automotive Cyberattacks Are Disrupting B2B Customer Experience - CX Today,https://www.cxtoday.com/crm/how-automotive-cyberattacks-are-disrupting-b2b-customer-experience/,2025-10-17 14:00:31,"Cybersecurity has become an unexpected speed bump on the road to digitalizing the automotive industry.

Recent cyber attacks on Jaguar Land Rover and Stellantis have exposed how vulnerable the sector is in its ability to deliver on the customer experience it promises to the consumers and business clients across its sprawling supply chain.

Typically, the conversation in automotive CX centers on showroom experience, mobile apps, and increasingly, infotainment systems. But behind the scenes, a vas",,-0.0258,Neutral,Cxtoday,https://www.cxtoday.com/crm/how-automotive-cyberattacks-are-disrupting-b2b-customer-experience/,False,Relevant Article,2,1,1,0,0,0,0
2,2,95,3 Must Have AI Cybersecurity Tools : AI Is Fighting Back Against Sophisticated Cyberattacks - Geeky Gadgets,https://www.geeky-gadgets.com/ai-powered-cybersecurity-tools-2025/,2025-10-17 13:14:44,"Imagine receiving an email that looks identical to one from your bank, complete with logos, professional language, and even a personalized greeting. You click a link, enter your credentials, and within minutes, your account is compromised. This isn’t a hypothetical scenario, it’s the reality of modern cybercrime, where AI-powered attacks are becoming more sophisticated and harder to detect. With over 166 million people affected by cyberattacks in 2023, the stakes have never been higher. But here",,0.3064,Positive,Geeky-gadgets,https://www.geeky-gadgets.com/ai-powered-cybersecurity-tools-2025/,False,Relevant Article,2,1,1,0,0,0,0
2,2,52,Microsoft: Romania ranks 52nd globally in terms of impact of cyberattacks in the first half of 2025 - Romania Insider,https://www.romania-insider.com/microsoft-romania-cyberattacks-first-half-2025,2025-10-17 13:11:55,"In the first half of 2025, Romania ranked 52nd worldwide among the countries most frequently affected by cyber activities, according to the new Microsoft Digital Defense Report.

The sixth annual report, covering trends from July 2024 to June 2025, emphasizes that traditional security measures are no longer sufficient. Modern defenses and strong collaboration between industries and governments are needed to keep pace with threats.

Romania is not among the most targeted nations, according to the",,0.2551,Positive,Romania-insider,https://www.romania-insider.com/microsoft-romania-cyberattacks-first-half-2025,False,Relevant Article,2,1,1,0,0,0,0
2,2,75,Microsoft: Cyberattackers are adopting artificial intelligence faster than defenders - Baltic News Network,https://bnn-news.com/microsoft-cyberattackers-are-adopting-artificial-intelligence-faster-than-defenders-273205,2025-10-17 10:43:31,"The Baltic states are not among the countries most frequently targeted by cyberattacks, said Renāte Strazdiņa, representative of Microsoft NTO Europe North Multi-country Cluster.

However, Strazdiņa notes that attackers are not resting – they are rapidly mastering the latest technologies, including artificial intelligence (AI), to improve and accelerate their attack methods.

According to data from Microsoft’s Digital Defense Report for the first half of 2025, Latvia ranks 64th worldwide among c",,0.4767,Positive,Bnn-news,https://bnn-news.com/microsoft-cyberattackers-are-adopting-artificial-intelligence-faster-than-defenders-273205,False,Relevant Article,2,1,1,0,0,0,0
2,2,90,"'Trump Is A Pig, Israel Lost War': Mass Cyberattack Hits US & Canadian Airports With Pro-Hamas Messages - Times Now",https://www.timesnownews.com/world/trump-is-a-pig-israel-lost-war-mass-cyberattack-hits-us-canadian-airports-with-pro-hamas-messages-article-153012989,2025-10-17 10:04:45,"Several airports were compromised, prompting investigations by transportation officials.

A coordinated cyberattack disrupted three Canadian airports and one in the US on Tuesday, displaying messages supporting Hamas and criticising President Donald Trump and Israeli Prime Minister Benjamin Netanyahu. Flight information screens were also affected, leaving passengers alarmed.

An ""advertisement streaming service"" at the Kelowna International Airport in British Columbia was briefly compromised and",,-0.8402,Negative,Timesnownews,https://www.timesnownews.com/world/trump-is-a-pig-israel-lost-war-mass-cyberattack-hits-us-canadian-airports-with-pro-hamas-messages-article-153012989,False,Relevant Article,1,0,1,0,0,0,0
2,2,86,"Microsoft’s BIG revelations! China, Russia, Iran, North Korea carry out cyberattacks against US, research say - india.com",https://www.india.com/us/microsofts-big-revelations-china-russia-iran-north-korea-carry-out-cyberattacks-against-us-research-says-8136547/,2025-10-17 09:25:42,"Home

Us

Microsofts BIG revelations! China, Russia, Iran, North Korea carry out cyberattacks against US, research says…

Microsoft’s BIG revelations! China, Russia, Iran, North Korea carry out cyberattacks against US, research says…

Microsoft research revealed that Russia, China are increasingly using AI to escalate cyberattacks on the US.

US President Donald Trump

Russia, China, Iran, and North Korea have reportedly escalated their use of artificial intelligence to spread online disinformat",,0.6093,Positive,India,https://www.india.com/us/microsofts-big-revelations-china-russia-iran-north-korea-carry-out-cyberattacks-against-us-research-says-8136547/,False,Relevant Article,2,1,1,0,0,0,0
2,2,24,Microsoft Report Warns of AI-Powered Automation in Cyberattacks and Malware Creation - GBHackers News,https://gbhackers.com/ai-powered-automation/,2025-10-17 09:21:01,"Cybercriminals are weaponizing artificial intelligence to accelerate malware development, discover vulnerabilities faster, and create more sophisticated phishing campaigns, according to Microsoft’s latest Digital Defense Report covering trends from July 2024 through June 2025.

In 80% of the cyber incidents Microsoft investigated last year, attackers sought to steal data primarily for profit rather than intelligence gathering.

The rise of AI-powered attacks has lowered the barrier to entry for ",,0.5984,Positive,Gbhackers,https://gbhackers.com/ai-powered-automation/,False,Relevant Article,2,1,1,0,0,0,0
2,2,96,"Russia's cyber attacks against NATO nations rise by 25% in 2025, Microsoft analysis finds - Firstpost",https://www.firstpost.com/tech/russias-cyber-attacks-against-nato-nations-rise-by-25-in-2025-microsoft-analysis-finds-13942768.html,2025-10-17 06:56:26,"Amid the war in Ukraine, Russia has increased its cyber-attacks on Nato nations by 25 per cent over the past year, Microsoft’s annual digital defence report reveals

Amid the war in Ukraine, Russia has increased its cyber-attacks on Nato nations by 25 per cent over the past year. According to the latest analysis by Microsoft, nine of the top 10 countries most affected by Russian state cyber-activity were members of the Nato alliance. The attacks are coming at a time when the Kremlin has escalate",,-0.8777,Negative,Firstpost,https://www.firstpost.com/tech/russias-cyber-attacks-against-nato-nations-rise-by-25-in-2025-microsoft-analysis-finds-13942768.html,False,Relevant Article,1,0,1,0,0,0,0
2,2,32,North Korean Hackers Expand Global Cyberattacks Using Blockchain Tools - CoinCentral,https://coincentral.com/north-korean-hackers-expand-global-cyberattacks-using-blockchain-tools/,2025-10-17 06:09:35,"TLDR

North Korean hackers are utilizing blockchain technology to develop decentralized command systems.

Fake job offers are a common tactic for North Korean cyberattacks.

Malware like BeaverTail and OtterCookie is used for credential theft.

EtherHiding malware hides payloads on public blockchains for stealth.

North Korea-linked hackers are increasing their global cyberattacks using new decentralized and evasive malware tools, according to recent reports from Cisco Talos and Google’s Threat ",,-0.5719,Negative,Coincentral,https://coincentral.com/north-korean-hackers-expand-global-cyberattacks-using-blockchain-tools/,False,Relevant Article,2,1,1,0,0,0,0
2,2,11,"Russia, China Using AI to Escalate Cyberattacks on the United States - politicstoday.org",https://politicstoday.org/russia-china-using-ai-to-escalate-cyberattacks-on-the-united-states/,2025-10-17 05:18:12,"R

ussia, China, Iran, and North Korea have dramatically ramped up their use of artificial intelligence (AI) to conduct cyberattacks and spread disinformation targeting the United States, according to new findings released by Microsoft on Thursday.

In its annual digital threats report, the tech giant said it identified more than 200 instances in July 2025 of foreign adversaries using AI to create or amplify fake content online — a figure that has doubled since 2024 and increased tenfold since 2",,0.6124,Positive,Politicstoday,https://politicstoday.org/russia-china-using-ai-to-escalate-cyberattacks-on-the-united-states/,False,Relevant Article,2,1,1,0,0,0,0
2,2,59,"Microsoft says Russia, China increasingly using AI to escalate cyberattacks on the U.S. - The Hindu",https://www.thehindu.com/sci-tech/technology/microsoft-says-russia-china-increasingly-using-ai-to-escalate-cyberattacks-on-the-us/article70174030.ece,2025-10-17 03:28:52,"Russia, China, Iran and North Korea have sharply increased their use of artificial intelligence to deceive people online and mount cyberattacks against the United States, according to new research from Microsoft.

This July, the company identified more than 200 instances of foreign adversaries using AI to create fake content online, more than double the number from July 2024 and more than ten times the number seen in 2023.

The findings, published Thursday in Microsoft’s annual digital threats r",,0.0258,Neutral,Thehindu,https://www.thehindu.com/sci-tech/technology/microsoft-says-russia-china-increasingly-using-ai-to-escalate-cyberattacks-on-the-us/article70174030.ece,False,Relevant Article,2,1,1,0,0,0,0
2,2,62,"Microsoft: Russia, China increasingly using AI to escalate cyberattacks on the US - KOAT",http://www.koat.com/article/ai-cyberattacks-microsoft-report-us-target/69058935,2025-10-17 01:20:00,"through the weekend before cooler and drier air arrives for next week. SEPTEMBER IS SUICIDE AWARENESS MONTH. IN VERMONT, OFFICIALS SAY SUICIDE DEATHS HAVE DECLINED FOR THREE STRAIGHT YEARS... BUT THE STATE IS STILL SEEING HUNDREDS OF PEOPLE STRUGGLING. NBC5'S CHARLOTTE HANCOX IS LIVE IN THE NEWSROOM WITH MORE ON THE DATA AND THE ADVICE FROM MENTAL HEALTH PROFESSIONALS. WELL ADRIAN AND ERICKA, OFFICIALS SAY RAISING AWARENESS IS KEY TO SAVING LIVES. AND WHILE THE NUMBERS IN VERMONT ARE HEADING IN ",,-0.7555,Negative,Koat,http://www.koat.com/article/ai-cyberattacks-microsoft-report-us-target/69058935,False,Relevant Article,2,1,1,0,0,0,0
2,2,53,"Microsoft: Russia, China increasingly using AI to escalate cyberattacks on the US - WAPT",https://www.wapt.com/article/ai-cyberattacks-microsoft-report-us-target/69058935,2025-10-17 01:20:00,"through the weekend before cooler and drier air arrives for next week. SEPTEMBER IS SUICIDE AWARENESS MONTH. IN VERMONT, OFFICIALS SAY SUICIDE DEATHS HAVE DECLINED FOR THREE STRAIGHT YEARS... BUT THE STATE IS STILL SEEING HUNDREDS OF PEOPLE STRUGGLING. NBC5'S CHARLOTTE HANCOX IS LIVE IN THE NEWSROOM WITH MORE ON THE DATA AND THE ADVICE FROM MENTAL HEALTH PROFESSIONALS. WELL ADRIAN AND ERICKA, OFFICIALS SAY RAISING AWARENESS IS KEY TO SAVING LIVES. AND WHILE THE NUMBERS IN VERMONT ARE HEADING IN ",,-0.7555,Negative,Wapt,https://www.wapt.com/article/ai-cyberattacks-microsoft-report-us-target/69058935,False,Relevant Article,2,1,1,0,0,0,0
2,2,60,"Microsoft: Russia, China increasingly using AI to escalate cyberattacks on the US - WGAL",https://www.wgal.com/article/ai-cyberattacks-microsoft-report-us-target/69058935,2025-10-17 01:20:00,"through the weekend before cooler and drier air arrives for next week. SEPTEMBER IS SUICIDE AWARENESS MONTH. IN VERMONT, OFFICIALS SAY SUICIDE DEATHS HAVE DECLINED FOR THREE STRAIGHT YEARS... BUT THE STATE IS STILL SEEING HUNDREDS OF PEOPLE STRUGGLING. NBC5'S CHARLOTTE HANCOX IS LIVE IN THE NEWSROOM WITH MORE ON THE DATA AND THE ADVICE FROM MENTAL HEALTH PROFESSIONALS. WELL ADRIAN AND ERICKA, OFFICIALS SAY RAISING AWARENESS IS KEY TO SAVING LIVES. AND WHILE THE NUMBERS IN VERMONT ARE HEADING IN ",,-0.7555,Negative,Wgal,https://www.wgal.com/article/ai-cyberattacks-microsoft-report-us-target/69058935,False,Relevant Article,2,1,1,0,0,0,0
2,2,64,Kearney Public Schools addresses cyberattack impact - Central Nebraska Today,https://www.centralnebraskatoday.com/2025/10/17/kearney-public-schools-address-cyberattack-impact/,2025-10-17 00:00:00,"KEARNEY — After receiving our final report from our Fortinet Incident Response Team, the hacking organization, Interlock, has publicly taken claim for and verified to have accessed sensitive data of current and former KPS staff and Special Education students.

The Interlock organization has targeted hundreds of businesses and educational institutions across the United States, and in many cases, pursued a financial “ransom”. However, in the KPS breach, school and district technology officials nev",,0.6705,Positive,Centralnebraskatoday,https://www.centralnebraskatoday.com/2025/10/17/kearney-public-schools-address-cyberattack-impact/,False,Relevant Article,1,0,1,0,0,0,0
2,2,12,Russian cyberattacks against NATO members up 25%: analysis - Euronews.com,https://www.euronews.com/next/2025/10/17/russian-cyberattacks-against-nato-members-up-25-in-a-year-analysis-shows,2025-10-17 00:00:00,"ADVERTISEMENT

Russian cyberattacks against NATO countries surged by 25 per cent in a year, according to a new analysis by Microsoft.

While Ukraine is still Russia’s primary target, the report found that the rest of the top 10 countries are all NATO members.

Twenty per cent of Russia’s cyberattacks targeted the United States, followed by the United Kingdom at 12 per cent and Germany at 6 per cent.

Belgium, Italy, Estonia, France, the Netherlands, and Poland were all targeted in 5 per cent or ",,0.7506,Positive,Euronews,https://www.euronews.com/next/2025/10/17/russian-cyberattacks-against-nato-members-up-25-in-a-year-analysis-shows,False,Relevant Article,2,1,1,0,0,0,0
2,2,19,"Israel ranks third worldwide in cyberattacks, Microsoft says - CTech",https://www.calcalistech.com/ctechnews/article/byfvftctel,2025-10-16 19:38:43,"Israel ranks third in the world for the number of cyberattacks, behind only the United States and the United Kingdom, according to Microsoft’s 2025 Digital Defense Report. The data shows that 3.5% of all global cyberattacks were directed at Israel, compared with 24.8% targeting the U.S. and 5.6% the U.K.

In the Middle East and Africa, Israel topped the regional list, absorbing 20.4% of all cyber incidents, a total of 603 documented attacks.

1 View gallery Hacker. ( Photo: Reuters )

The report",,0.5423,Positive,Calcalistech,https://www.calcalistech.com/ctechnews/article/byfvftctel,False,Relevant Article,2,1,1,0,0,0,0
2,2,5,How utilities work together to guard against cyberattacks - Entergy,https://www.entergy.com/blog/how-utilities-work-together-to-guard-against-cyberattacks,2025-10-16 18:46:00,"October is National Cybersecurity Month, but for utility employees at Entergy, security is central to our everyday work.

The term “shared threat landscape” is often used by cybersecurity experts. But what does it mean?

A shared threat landscape means many organizations face similar cyber risks. These include threats to outdated systems that run operations, as well as risks tied to supply chain and vendors. Attackers often use familiar methods such as phishing, ransomware, insider compromise an",,-0.9468,Negative,Entergy,https://www.entergy.com/blog/how-utilities-work-together-to-guard-against-cyberattacks,False,Relevant Article,2,1,1,0,0,0,0
2,2,49,Hackers backed by China blamed for cyberattack on Seattle tech company - MyNorthwest.com,https://mynorthwest.com/local/f5-inc-cyberattack-seattle/4143844,2025-10-16 17:27:58,"More information has been released after a Seattle tech company said it was hit by a sophisticated cyberattack.

Hackers backed by the Chinese government are being blamed for the attack on Seattle-based F5 Inc., Bloomberg reported. Meanwhile, China publicly denied it.

“Regarding such groundless accusation made without evidence, we have made clear China’s position more than once,” China Foreign Ministry spokesman Lin Jian said at a press conference, according to Bloomberg. “China always opposes ",,-0.7783,Negative,Mynorthwest,https://mynorthwest.com/local/f5-inc-cyberattack-seattle/4143844,False,Relevant Article,1,0,1,0,0,0,0
2,2,4,"Microsoft: Russia, China increasingly using AI to escalate cyberattacks on the US - AP News",https://apnews.com/article/ai-cybersecurity-russia-china-deepfakes-microsoft-ad678e5192dd747834edf4de03ac84ee,2025-10-16 14:44:35,"WASHINGTON (AP) — Russia, China, Iran and North Korea have sharply increased their use of artificial intelligence to deceive people online and mount cyberattacks against the United States, according to new research from Microsoft.

This July, the company identified more than 200 instances of foreign adversaries using AI to create fake content online, more than double the number from July 2024 and more than ten times the number seen in 2023.

The findings, published Thursday in Microsoft’s annual",,0.4404,Positive,Apnews,https://apnews.com/article/ai-cybersecurity-russia-china-deepfakes-microsoft-ad678e5192dd747834edf4de03ac84ee,False,Relevant Article,2,1,1,0,0,0,0
2,2,30,"Microsoft: Russia, China increasingly using AI to escalate cyberattacks on the US - WGAU Radio",https://www.wgauradio.com/news/technology/microsoft-russia/A2NASJOZWQ3WXF4JVMVLTDCIBQ/?outputType=amp,2025-10-16 14:44:35,"WASHINGTON — Russia, China, Iran and North Korea have sharply increased their use of artificial intelligence to deceive people online and mount cyberattacks against the United States, according to new research from Microsoft.

This July, the company identified more than 200 instances of foreign adversaries using AI to create fake content online, more than double the number from July 2024 and more than ten times the number seen in 2023.

The findings, published Thursday in Microsoft's annual digi",,0.4404,Positive,Wgauradio,https://www.wgauradio.com/news/technology/microsoft-russia/A2NASJOZWQ3WXF4JVMVLTDCIBQ/?outputType=amp,False,Relevant Article,2,1,1,0,0,0,0
2,2,102,"Cyberattack on Indian Ports Could Freeze Global Trade, Warns Navy Chief - indianwitness.com",https://www.indianwitness.com/news/national/cyberattack-on-indian-ports-could-freeze-global-trade-w,2025-10-16 14:37:30,"Navy Chief Admiral Dinesh K. Tripathi has sounded a stark warning about the growing cyber vulnerabilities in India’s maritime domain as the country’s ports and naval systems rapidly digitize. Speaking at a seminar on the “Impact of Cyber-attacks in the Maritime Sector,” Admiral Tripathi said the implications of a cyber disruption across India’s 12 major ports, over 200 smaller ports, and an 11,000-kilometre coastline could be “enormous” for national security and global trade stability.

“The sea",,0.25,Positive,Indianwitness,https://www.indianwitness.com/news/national/cyberattack-on-indian-ports-could-freeze-global-trade-w,False,Relevant Article,1,0,1,0,0,0,0
2,2,119,China-linked APT Jewelbug targets Russian IT provider in rare cross-nation cyberattack - Security Affairs,https://securityaffairs.com/183488/apt/china-linked-apt-jewelbug-targets-russian-it-provider-in-rare-cross-nation-cyberattack.html,2025-10-16 14:08:00,"China-linked APT Jewelbug targets Russian IT provider in rare cross-nation cyberattack

Pierluigi Paganini October 16, 2025 October 16, 2025

China-linked APT Jewelbug targeted a Russian IT provider for five months in 2025, showing Russia remains exposed to Chinese cyber espionage.

China-linked threat actor Jewelbug (aka CL-STA-0049, Earth Alux, and REF7707) carried out a five-month intrusion on a Russian IT service provider, marking its expansion beyond Southeast Asia and South America. The ca",,-0.3182,Negative,Securityaffairs,https://securityaffairs.com/183488/apt/china-linked-apt-jewelbug-targets-russian-it-provider-in-rare-cross-nation-cyberattack.html,False,Relevant Article,1,0,1,0,0,0,0
2,2,38,Switzerland ranks ninth in Europe for cyberattack frequency - Microsoft Source,https://news.microsoft.com/source/emea/2025/10/switzerland-ranks-ninth-in-europe-for-cyberattack-frequency/,2025-10-16 14:01:34,"Switzerland ranked ninth in Europe and 22nd globally for frequency of cyberattacks in the first half of 2025, according to the sixth Microsoft’s Digital Defense Report released today. The country accounted for approximately 3.3% of all European organizations impacted by malicious cyber activity—meaning about three out of every 100 affected European organizations are Swiss.

Key findings:

At least 52% of cyberattacks worldwide were driven by ransomware or extortion, while only 4% focused solely ",,0.3612,Positive,News,https://news.microsoft.com/source/emea/2025/10/switzerland-ranks-ninth-in-europe-for-cyberattack-frequency/,False,Relevant Article,2,1,1,0,0,0,0
2,2,48,F5 systems data stolen in major nation-state cyberattack - Silicon Republic,https://www.siliconrepublic.com/enterprise/f5-cyberattack-cybersecurity-breach-big-ip,2025-10-16 12:01:42,"Sources familiar with the matter told Bloomberg that Chinese state-sponsored hackers were responsible for the breach, and that the attackers had remained in F5’s network for at least a year.

Yesterday (15 October), US cybersecurity company F5 disclosed knowledge of a significant cyberattack that gave threat actors long-term access to some of its systems.

According to a regulatory filing submitted by the company, F5 first learned of the breach – which it attributed to a “highly sophisticated na",,-0.5423,Negative,Siliconrepublic,https://www.siliconrepublic.com/enterprise/f5-cyberattack-cybersecurity-breach-big-ip,False,Relevant Article,1,0,1,0,0,0,0
2,2,74,Mango Data Breach Confirms Exposure Of Limited Customer Info - The Cyber Express,https://thecyberexpress.com/mango-data-breach/,2025-10-16 09:27:16,"Spanish fashion retailer Mango has confirmed a data breach after one of its external marketing service providers suffered unauthorized access to limited customer information. The company emphasized that its corporate systems were not compromised and that financial or login details remain secure. The Mango data breach adds to a growing list of cybersecurity incidents hitting major global retailers in 2025.

In its official statement, Mango said the exposed data included customers’ first names, co",,-0.4939,Negative,Thecyberexpress,https://thecyberexpress.com/mango-data-breach/,False,Relevant Article,1,0,1,0,0,0,0
